{
  "$schema": "http://json-schema.org/draft-07/schema#",
  "$id": "https://cdn.uat.accredify.io/schema/acra/bizfiles/profiles/limited-liability-partnership/1.0/schema.json",
  "type": "object",
  "properties": {
    "entityName": {
      "$ref": "../../../common/1.0/definitions/schema.json#/definitions/entityName"
    },
    "formerNames": {
      "$ref": "../../../common/1.0/definitions/schema.json#/definitions/formerNames"
    },
    "uen": {
      "$ref": "../../../common/1.0/definitions/schema.json#/definitions/uen"
    },
    "registrationDate": {
      "$ref": "../../../common/1.0/definitions/schema.json#/definitions/date"
    },
    "status": {
      "type": "string"
    },
    "statusDate": {
      "$ref": "../../../common/1.0/definitions/schema.json#/definitions/date"
    },
    "address": {
      "$ref": "../../../common/1.0/definitions/schema.json#/definitions/address"
    },
    "changeOfNameDate": {
      "$ref": "../../../common/1.0/definitions/schema.json#/definitions/date"
    },
    "changeOfAddressDate": {
      "$ref": "../../../common/1.0/definitions/schema.json#/definitions/date"
    },
    "annualDeclarationDate": {
      "$ref": "../../../common/1.0/definitions/schema.json#/definitions/date"
    },
    "activities": {
      "$ref": "../../../common/1.0/definitions/schema.json#/definitions/activities"
    },
    "conversionMessage": {
      "type": "string"
    },
    "partners": {
      "type": "array",
      "items": {
        "allOf": [
          {
            "$ref": "../../../common/1.0/definitions/schema.json#/definitions/person"
          }
        ],
        "properties": {
          "appointmentDate": {
            "$ref": "../../../common/1.0/definitions/schema.json#/definitions/date"
          },
          "withdrawalDate": {
            "$ref": "../../../common/1.0/definitions/schema.json#/definitions/date"
          }
        },
        "required": [
          "appointmentDate"
        ]
      }
    },
    "partnersUnder18A": {
      "type": "array",
      "items": {
        "allOf": [
          {
            "$ref": "../../../common/1.0/definitions/schema.json#/definitions/person"
          }
        ],
        "properties": {
          "appointmentDate": {
            "$ref": "../../../common/1.0/definitions/schema.json#/definitions/date"
          },
          "withdrawalDate": {
            "$ref": "../../../common/1.0/definitions/schema.json#/definitions/date"
          }
        },
        "required": [
          "appointmentDate"
        ]
      }
    },
    "managers": {
      "type": "array",
      "items": {
        "allOf": [
          {
            "$ref": "../../../common/1.0/definitions/schema.json#/definitions/person"
          }
        ],
        "properties": {
          "appointmentDate": {
            "$ref": "../../../common/1.0/definitions/schema.json#/definitions/date"
          },
          "withdrawalDate": {
            "$ref": "../../../common/1.0/definitions/schema.json#/definitions/date"
          }
        },
        "required": [
          "appointmentDate"
        ]
      }
    },
    "liquidators": {
      "type": "array",
      "items": {
        "$ref": "../../../common/1.0/definitions/schema.json#/definitions/otherMembers"
      }
    },
    "provisionalLiquidators": {
      "type": "array",
      "items": {
        "$ref": "../../../common/1.0/definitions/schema.json#/definitions/otherMembers"
      }
    },
    "employees": {
      "type": "array",
      "items": {
        "allOf": [
          {
            "$ref": "../../../common/1.0/definitions/schema.json#/definitions/person"
          }
        ],
        "properties": {
          "appointmentDate": {
            "$ref": "../../../common/1.0/definitions/schema.json#/definitions/date"
          },
          "withdrawalDate": {
            "$ref": "../../../common/1.0/definitions/schema.json#/definitions/date"
          }
        },
        "required": [
          "appointmentDate"
        ]
      }
    },
    "receiptNumber": {
      "$ref": "../../../common/1.0/definitions/schema.json#/definitions/receiptNumber"
    },
    "receiptDate": {
      "$ref": "../../../common/1.0/definitions/schema.json#/definitions/date",
      "description": "The date at which this certificate was purchased in DD/MM/YYYY format"
    },
    "signatureName": {
      "$ref": "../../../common/1.0/definitions/schema.json#/definitions/signatureName"
    },
    "qrCode": {
      "$ref": "../../../common/1.0/definitions/schema.json#/definitions/qrCode"
    },
    "authenticationNumber": {
      "$ref": "../../../common/1.0/definitions/schema.json#/definitions/authenticationNumber"
    }
  },
  "required": [
    "entityName",
    "uen",
    "registrationDate",
    "status",
    "statusDate",
    "address",
    "activities",
    "managers",
    "signatureName"
  ]
}
